X,Y,nom_du_muse,ref_musee,adr,cp,ville,telephone1,fax,sitweb,fermeture_a,periode_ouv,jours_noctu,date_appell,date_retrai,region,departement,icon_url
-33.2353969377958,-85.5266088919994,Musée Historique de Villèle,"9743501",Domaine Panon-Desbassayns-Villèle B.P. N° 2,"97435",SAINT-GILLES-LES-HAUTS,"0262556410","0262555191",Site internet du Conseil général - http//www.cg974.fr,"1er janvier, 1er mai, 25 décembre",Ouvert du mardi au dimanche et les jours fériés de 9h30 à 12h30 et de 13h30 à 17h30,,01/02/2003,,LA REUNION,REUNION,./0.png
-33.2354225208706,-85.526609684355,Musée des Arts Décoratifs de l’Océan indien (MADOI),"9741401","17 A, Chemin Rouge","97450",SAINT-LOUIS,"0262912430","0262912435",http://www.madoi.re ou www.museesreunion.re,,Ouvert du lundi au dimanche de 9h à 17h,,01/02/2003,,LA REUNION,REUNION,./0.png
-33.2354149832161,-85.5266086440447,Muséum Agricole et Industriel Stella Matutina,"9741301","6,Allée des Flamboyants","97424",PITON-SAINT-LEU,"0262341624","0262965228",www.museesreunion.re,"1er janvier, 1er mai, 11 novembre, 25 décembre",Ouvert le lundi de 13h à 17h30 et du mardi au dimanche de 9h30 à 17h30,,01/02/2003,,LA REUNION,REUNION,./0.png
-33.2353785819615,-85.5266100414964,Musée Départemental de la Réunion - Musée Léon Dierx,"9741101","28, rue de Paris","97400",SAINT-DENIS,"0262202482","0262218287",www.cg974.fr/culture:leon-dierx,,Ouvert du mardi au dimanche 9h30 à 17h30,,01/02/2003,,LA REUNION,REUNION,./0.png
-33.2353790420739,-85.5266100520733,Muséum d'Histoire Naturelle,"9741102","1, rue Poivre","97400",SAINT-DENIS DE LA REUNION,"0262200219","0262213393",http//www.cg974.fr/museum,1er mai,Ouvert du mardi au dimanche et jours fériés de 9h30 à 17h30,,06/01/2002,,LA REUNION,REUNION,./0.png
